{
  "schema_version": "1.0",
  "repository": "jlov7/damn-vulnerable-agent-asset-corpus",
  "recorded_as_of": "2026-05-25",
  "branch_protection": {
    "branch": "main",
    "strict_required_checks": [
      "conformance",
      "Analyze Python",
      "Verify DVAAC release fingerprint",
      "Quality checks",
      "OpenSSF Scorecard"
    ],
    "required_pull_request_reviews": true,
    "required_approving_review_count": 0,
    "enforce_admins": true,
    "required_linear_history": true,
    "required_conversation_resolution": true,
    "allow_force_pushes": false,
    "allow_deletions": false
  },
  "merge_policy": {
    "allow_merge_commit": false,
    "allow_rebase_merge": false,
    "allow_squash_merge": true,
    "delete_branch_on_merge": true
  },
  "security_analysis": {
    "dependabot_security_updates": "enabled",
    "secret_scanning": "enabled",
    "secret_scanning_push_protection": "enabled",
    "secret_scanning_non_provider_patterns": "disabled",
    "secret_scanning_validity_checks": "disabled"
  },
  "code_scanning": {
    "open_alerts": 0
  },
  "publication_gate": {
    "local_release_requires_live_posture": true,
    "ci_default_live_posture_required": false,
    "ci_live_posture_opt_in_env": "REQUIRE_LIVE_REPOSITORY_POSTURE=1",
    "ci_live_posture_requires_branch_protection_read_token": true
  },
  "claim_boundary": {
    "self_reported": true,
    "third_party_validation_claimed": false
  }
}
